{
  "analysisScope": {
    "mode": "BROWNFIELD",
    "asOfDate": "2026-08-19",
    "repositorySnapshots": [
      {"repoId": "service-api", "path": "repositories/service-api", "revision": "bbbbbbbbbbbbbbbbbbbbbbbbbbbbbbbbbbbbbbbb", "dirty": false}
    ],
    "priorSowSnapshots": [
      {"priorSowId": "sow-phase-one", "file": ".ai-sow/inputs/analyze-as-is/prior-sows/sow-phase-one.md", "originalName": "phase-one.md", "sha256": "6aaa4f5427e455cde2603adb68209ac6ab5a75b32c02e0da866914a757ac93b8"}
    ],
    "includedSystems": ["Customer API（客户接口）"],
    "includedAreas": ["客户档案服务"],
    "excludedAreas": ["旧版账单批处理"]
  },
  "topicAssessments": [
    {"topic": "SYSTEM_CONTEXT", "status": "ASSESSED", "summary": "Customer API（客户接口）的边界和负责人已明确。", "uncertaintyIds": []},
    {"topic": "CAPABILITY", "status": "ASSESSED", "summary": "当前客户能力与往期承诺的客户能力已核对。", "uncertaintyIds": []},
    {"topic": "APPLICATION", "status": "ASSESSED", "summary": "当前 Customer API（客户接口）组件已通过代码验证。", "uncertaintyIds": []},
    {"topic": "INTEGRATION", "status": "NOT_APPLICABLE", "summary": "范围内不存在集成。", "uncertaintyIds": []},
    {"topic": "DATA", "status": "INSUFFICIENT_EVIDENCE", "summary": "现有仓库无法确认数据保留行为。", "uncertaintyIds": ["uncertainty-data-retention"]},
    {"topic": "PLATFORM", "status": "ASSESSED", "summary": "当前服务部署边界已记录。", "uncertaintyIds": []},
    {"topic": "SECURITY_COMPLIANCE", "status": "ASSESSED", "summary": "现有访问控制边界已评审。", "uncertaintyIds": []},
    {"topic": "OPERATIONS_QUALITY", "status": "ASSESSED", "summary": "当前运维信号和差距已评估。", "uncertaintyIds": []},
    {"topic": "DELIVERY_CONSTRAINTS", "status": "ASSESSED", "summary": "延续承诺仍属于交付范围。", "uncertaintyIds": []}
  ],
  "items": [
    {
      "asIsItemId": "asis-customer-api",
      "topic": "APPLICATION",
      "itemType": "COMPONENT",
      "name": "Customer API（客户接口）",
      "summary": "已部署服务提供当前客户档案读取模型。",
      "repositoryIds": ["service-api"]
    }
  ],
  "commitments": [
    {
      "commitmentId": "commitment-loyalty-profile",
      "priorSowId": "sow-phase-one",
      "sourceReference": "prior-sow:sow-phase-one#section=customer-profile",
      "topic": "CAPABILITY",
      "changeType": "ADD",
      "name": "客户忠诚度档案",
      "summary": "在客户档案中增加忠诚度状态。",
      "implementationStatus": "NOT_IMPLEMENTED",
      "treatment": "CARRY_FORWARD",
      "affectedItemIds": [],
      "relatedFeatureIds": ["feature-customer-profile"]
    }
  ],
  "effectiveStartItems": [
    {
      "effectiveStartItemId": "effective-start-customer-api",
      "topic": "APPLICATION",
      "itemType": "COMPONENT",
      "name": "生效起点的 Customer API（客户接口）",
      "summary": "当前 Customer API（客户接口）是经验证的生效起点。",
      "sourceItemIds": ["asis-customer-api"],
      "commitmentIds": []
    }
  ],
  "coverage": [
    {
      "featureId": "feature-customer-profile",
      "status": "PARTIAL",
      "effectiveStartItemIds": ["effective-start-customer-api"],
      "commitmentIds": ["commitment-loyalty-profile"],
      "uncertaintyIds": ["uncertainty-data-retention"],
      "rationale": "当前 API 可复用，忠诚度数据仍属于延续范围，数据保留问题尚未解决。"
    }
  ],
  "uncertainties": [
    {
      "uncertaintyId": "uncertainty-data-retention",
      "topic": "DATA",
      "question": "客户档案适用多长的数据保留期？",
      "impact": "答案会影响存储设计和合规范围。",
      "affectsEstimate": true,
      "owner": "数据治理团队",
      "recommendedHandling": "在方案设计批准前确认。",
      "relatedFeatureIds": ["feature-customer-profile"]
    }
  ],
  "evidence": [
    {
      "evidenceId": "evidence-customer-api-code",
      "kind": "CODE",
      "reference": "service-api:src/customer/profile.py#CustomerProfileReader",
      "summary": "仓库包含当前客户档案读取组件。",
      "supportsIds": ["asis-customer-api"]
    },
    {
      "evidenceId": "evidence-phase-one-sow",
      "kind": "PRIOR_SOW",
      "reference": "prior-sow:sow-phase-one#section=customer-profile",
      "summary": "往期 SOW 承诺增加忠诚度状态。",
      "supportsIds": ["commitment-loyalty-profile"]
    },
    {
      "evidenceId": "evidence-retention-question",
      "kind": "QUESTIONNAIRE",
      "reference": "questionnaire:DATA-01",
      "summary": "数据保留问题仍未得到答复。",
      "supportsIds": ["uncertainty-data-retention"]
    },
    {
      "evidenceId": "evidence-source-requirement",
      "kind": "DOCUMENT",
      "reference": "requirements:feature-customer-profile",
      "summary": "源需求明确了客户档案范围。",
      "supportsIds": ["feature-customer-profile"]
    }
  ]
}
